{"audit_events":[{"aggregate_id":"problem.sum-two-squares-mod-four","created_at":"2026-08-21T00:00:00.000000Z","created_by":"actor.josh_kettlewell","event_type":"problem_definition_recorded","id":"event.sum-two-squares-mod-four.problem_definition_recorded","idempotency_key":"problem-definition-recorded:sum-two-squares-mod-four:sha256:61ce0bfad20f06450c4c8da788745373c428576a1ac0999ac4b49574dea31804","object_type":"AuditEvent","payload":[["declared_domain","number-theory"],["intake_creates_no_warrant","true"],["originating_principal","actor.josh_kettlewell"],["problem_definition_canonical_hash","sha256:61ce0bfad20f06450c4c8da788745373c428576a1ac0999ac4b49574dea31804"],["problem_definition_id","sum-two-squares-mod-four"],["problem_definition_schema_version","1.0.0"],["target_claim_id","claim.sum-two-squares-mod-four.three_mod_four_not_sum_of_two_squares"]],"schema_version":"1.0.0"}],"capabilities":["canonical_json","declarative_problem_intake","policy_projection"],"claims":[{"assumption_claim_ids":[],"contribution_ids":[],"created_at":"2026-08-21T00:00:00.000000Z","created_by":"actor.josh_kettlewell","id":"claim.sum-two-squares-mod-four.square_residues_mod_four","kind":"lemma","novelty_assessment_id":null,"object_type":"Claim","origin":"user","representation_map_ids":[],"schema_version":"1.0.0","scope":"unrestricted_universal","significance_assessment_id":null,"statement":"For every integer a, a^2 = 0 (mod 4) or a^2 = 1 (mod 4)."},{"assumption_claim_ids":["claim.sum-two-squares-mod-four.square_residues_mod_four"],"contribution_ids":[],"created_at":"2026-08-21T00:00:00.000000Z","created_by":"actor.josh_kettlewell","id":"claim.sum-two-squares-mod-four.three_mod_four_not_sum_of_two_squares","kind":"theorem","novelty_assessment_id":null,"object_type":"Claim","origin":"user","representation_map_ids":[],"schema_version":"1.0.0","scope":"unrestricted_universal","significance_assessment_id":null,"statement":"For every integer n with n = 3 (mod 4), there are no integers a and b such that n = a^2 + b^2."}],"content_hash":"sha256:f48fb59d395642f0dd73a9056fd2bee4ce5c5c806aa538cb9c4fe54f3e94b9d1","created_at":"2026-08-21T00:00:00.000000Z","created_by":"actor.josh_kettlewell","evaluation_protocol":{"created_at":"2026-08-21T00:00:00.000000Z","created_by":"actor.josh_kettlewell","frozen_at":null,"frozen_by":null,"id":"protocol.sum-two-squares-mod-four.v1","metrics":["obligations_opened","obligations_discharged"],"object_type":"EvaluationProtocol","phase":"exploratory","schema_version":"1.0.0","stopping_rules":["stop on a checked counterexample","stop when the open obligation set is unchanged across two review points"],"success_criteria":["a derivation covering every integer congruent to three modulo four, not a finite sample"],"version":1},"evidence":[],"formalization":{"approval_status":"proposed","assumption_claim_ids":["claim.sum-two-squares-mod-four.square_residues_mod_four"],"created_at":"2026-08-21T00:00:00.000000Z","created_by":"actor.josh_kettlewell","formal_language":"typed_informal_math","id":"formalization.sum-two-squares-mod-four.v1","object_type":"Formalization","problem_id":"problem.sum-two-squares-mod-four","quantifiers":["forall n an integer"],"schema_version":"1.0.0","statement":"forall n : Integer, n mod 4 = 3 implies not exists a b : Integer, n = a * a + b * b","target_claim_id":"claim.sum-two-squares-mod-four.three_mod_four_not_sum_of_two_squares","version":1},"id":"dossier.sum-two-squares-mod-four.intake.sha256-61ce0bfad20f0645","object_type":"ResearchDossier","obligations":[{"category":"semantic_alignment","claim_id":"claim.sum-two-squares-mod-four.three_mod_four_not_sum_of_two_squares","created_at":"2026-08-21T00:00:00.000000Z","created_by":"actor.josh_kettlewell","description":"The declared target interpretation is proposed and awaits researcher approval of the semantic alignment record.","discharged_by_warrant_id":null,"id":"obligation.sum-two-squares-mod-four.alignment_unapproved","normalized_statement":null,"object_type":"ProofObligation","parent_obligation_id":null,"schema_version":"1.0.0","status":"open"},{"category":"logical_gap","claim_id":"claim.sum-two-squares-mod-four.three_mod_four_not_sum_of_two_squares","created_at":"2026-08-21T00:00:00.000000Z","created_by":"actor.josh_kettlewell","description":"The declarative problem intake supplies no warrant, evidence, or verification record for the target claim.","discharged_by_warrant_id":null,"id":"obligation.sum-two-squares-mod-four.target_unwarranted","normalized_statement":null,"object_type":"ProofObligation","parent_obligation_id":null,"schema_version":"1.0.0","status":"open"}],"problem":{"active_formalization_id":"formalization.sum-two-squares-mod-four.v1","created_at":"2026-08-21T00:00:00.000000Z","created_by":"actor.josh_kettlewell","id":"problem.sum-two-squares-mod-four","informal_statement":"Show that if an integer n leaves remainder three on division by four, then n cannot be written as a sum of two integer squares.\n\nThe target is stated for every such integer, with no upper bound.","object_type":"ResearchProblem","problem_type":"prove","schema_version":"1.0.0","tags":["number-theory","quadratic-residues","unrestricted-universal-target"],"title":"No integer congruent to three modulo four is a sum of two squares"},"representation_maps":[],"schema_version":"1.0.0","semantic_alignment":{"approved_by":null,"assumption_delta":["The informal statement says 'remainder three on division by four'; the formalization writes n mod 4 = 3 and adds no further hypothesis."],"compared_claim_id":"claim.sum-two-squares-mod-four.three_mod_four_not_sum_of_two_squares","created_at":"2026-08-21T00:00:00.000000Z","created_by":"actor.josh_kettlewell","definition_mapping":[["n mod 4","the least nonnegative residue of n modulo four"]],"edge_case_delta":["Negative n are included, since the residue is taken as the least nonnegative one."],"formalization_id":"formalization.sum-two-squares-mod-four.v1","id":"alignment.sum-two-squares-mod-four.v1","object_type":"SemanticAlignmentRecord","problem_id":"problem.sum-two-squares-mod-four","quantifier_mapping":[["n","an integer congruent to three modulo four"]],"schema_version":"1.0.0","status":"proposed","strength_relation":"equivalent"},"source_applicability":[],"verification_records":[],"warrants":[]}
