{"audit_events":[{"aggregate_id":"problem.even_sum.v1","created_at":"2026-08-19T00:00:00.000000Z","created_by":"actor.manual_researcher","event_type":"phase2_accepted_state_created","id":"event.phase2.accepted_state.v1","idempotency_key":"phase2-accepted-state-v1","object_type":"AuditEvent","payload":[["target_claim_id","claim.even_sum.v1"],["trust_status","unknown"]],"schema_version":"1.0.0"}],"capabilities":["canonical_json","policy_projection","append_only_events","durable_workspace","proposal_only_model_loop"],"claims":[{"assumption_claim_ids":[],"contribution_ids":[],"created_at":"2026-08-19T00:00:00.000000Z","created_by":"actor.manual_researcher","id":"claim.even_definition.v1","kind":"definition","novelty_assessment_id":null,"object_type":"Claim","origin":"source","representation_map_ids":[],"schema_version":"1.0.0","scope":"definitional","significance_assessment_id":null,"statement":"An integer n is even iff there exists k in Z with n = 2k."},{"assumption_claim_ids":["claim.even_definition.v1"],"contribution_ids":[],"created_at":"2026-08-19T00:00:00.000000Z","created_by":"actor.manual_researcher","id":"claim.even_sum.v1","kind":"theorem","novelty_assessment_id":null,"object_type":"Claim","origin":"user","representation_map_ids":["representation.integer_algebra.v1"],"schema_version":"1.0.0","scope":"unrestricted_universal","significance_assessment_id":null,"statement":"For all integers a and b, if a and b are even, then a + b is even."},{"assumption_claim_ids":["claim.even_definition.v1"],"contribution_ids":[],"created_at":"2026-08-19T00:00:00.000000Z","created_by":"actor.manual_researcher","id":"claim.integer_algebra_encoding.v1","kind":"equivalence","novelty_assessment_id":null,"object_type":"Claim","origin":"user","representation_map_ids":[],"schema_version":"1.0.0","scope":"unrestricted_universal","significance_assessment_id":null,"statement":"Integer algebra preserves addition and the existential definition of even."}],"content_hash":"sha256:7c4a99e1b129b0bb4192094778a87cdd9c945a5d87cf0f7f6c00f6f9509408f7","created_at":"2026-08-19T00:00:00.000000Z","created_by":"actor.manual_researcher","evaluation_protocol":{"created_at":"2026-08-19T00:00:00.000000Z","created_by":"actor.manual_researcher","frozen_at":"2026-08-19T00:00:00.000000Z","frozen_by":"actor.manual_researcher","id":"protocol.manual_slice.v1","metrics":["target_fidelity","trace_completeness"],"object_type":"EvaluationProtocol","phase":"confirmatory","schema_version":"1.0.0","stopping_rules":["one deterministic construction and replay"],"success_criteria":["exact target is policy-projected as proved","all report claims cite entity IDs"],"version":1},"evidence":[{"artifact_hash":"sha256:0d91189a7355fc249fbf4496d0f07faeea7597362a54d73f4f14da52a27bbcdb","claim_id":"claim.even_definition.v1","content":"Definition: n is even exactly when n=2k for an integer k.","created_at":"2026-08-19T00:00:00.000000Z","created_by":"actor.manual_researcher","disposition":"accepted","id":"evidence.even_definition_source.v1","kind":"source_span","object_type":"Evidence","schema_version":"1.0.0","source_ref":"local:manual-source#line-1"},{"artifact_hash":"sha256:ec24ef8f02208066dc41db7098246810447ce37363bb34a513967d84dd439b14","claim_id":"claim.integer_algebra_encoding.v1","content":"The representation uses the same integer carrier, addition, multiplication by 2, and existential quantifier.","created_at":"2026-08-19T00:00:00.000000Z","created_by":"actor.manual_researcher","disposition":"accepted","id":"evidence.integer_algebra_bridge.v1","kind":"derivation","object_type":"Evidence","schema_version":"1.0.0","source_ref":null}],"formalization":{"approval_status":"approved","assumption_claim_ids":["claim.even_definition.v1"],"created_at":"2026-08-19T00:00:00.000000Z","created_by":"actor.manual_researcher","formal_language":"typed_informal_math","id":"formalization.even_sum.v1","object_type":"Formalization","problem_id":"problem.even_sum.v1","quantifiers":["forall a in Z","forall b in Z"],"schema_version":"1.0.0","statement":"forall a b : Z, Even(a) and Even(b) implies Even(a+b)","target_claim_id":"claim.even_sum.v1","version":1},"id":"dossier.even_sum.phase2.open.v1","object_type":"ResearchDossier","obligations":[{"category":"logical_gap","claim_id":"claim.even_sum.v1","created_at":"2026-08-19T00:00:00.000000Z","created_by":"actor.manual_researcher","description":"Provide a complete proof of the exact target.","discharged_by_warrant_id":null,"id":"obligation.even_sum_proof.v1","normalized_statement":null,"object_type":"ProofObligation","parent_obligation_id":null,"schema_version":"1.0.0","status":"open"},{"category":"literature_applicability","claim_id":"claim.even_definition.v1","created_at":"2026-08-19T00:00:00.000000Z","created_by":"actor.manual_researcher","description":"Check domain, definition, and hypotheses of the cited definition.","discharged_by_warrant_id":"warrant.even_definition_source.v1","id":"obligation.even_definition_applicability.v1","normalized_statement":null,"object_type":"ProofObligation","parent_obligation_id":null,"schema_version":"1.0.0","status":"discharged"},{"category":"representation_bridge","claim_id":"claim.integer_algebra_encoding.v1","created_at":"2026-08-19T00:00:00.000000Z","created_by":"actor.manual_researcher","description":"Show that the representation preserves every operation used by the proof.","discharged_by_warrant_id":"warrant.integer_algebra_bridge.v1","id":"obligation.integer_algebra_bridge.v1","normalized_statement":null,"object_type":"ProofObligation","parent_obligation_id":null,"schema_version":"1.0.0","status":"discharged"}],"problem":{"active_formalization_id":"formalization.even_sum.v1","created_at":"2026-08-19T00:00:00.000000Z","created_by":"actor.manual_researcher","id":"problem.even_sum.v1","informal_statement":"For all integers a and b, if a and b are even, then a + b is even.","object_type":"ResearchProblem","problem_type":"prove","schema_version":"1.0.0","tags":["integer-arithmetic","manual-slice"],"title":"Sum of two even integers"},"representation_maps":[{"bridge_obligation_ids":["obligation.integer_algebra_bridge.v1"],"created_at":"2026-08-19T00:00:00.000000Z","created_by":"actor.manual_researcher","encoding_claim_id":"claim.integer_algebra_encoding.v1","exceptional_case_claim_ids":[],"id":"representation.integer_algebra.v1","object_type":"RepresentationMap","preserved_property_claim_ids":["claim.even_sum.v1"],"schema_version":"1.0.0","source_representation":"informal integer arithmetic","status":"verified","target_representation":"typed integer algebra"}],"schema_version":"1.0.0","semantic_alignment":{"approved_by":"actor.manual_researcher","assumption_delta":[],"compared_claim_id":"claim.even_sum.v1","created_at":"2026-08-19T00:00:00.000000Z","created_by":"actor.manual_researcher","definition_mapping":[["Even(n)","exists k in Z, n=2k"]],"edge_case_delta":[],"formalization_id":"formalization.even_sum.v1","id":"alignment.even_sum.v1","object_type":"SemanticAlignmentRecord","problem_id":"problem.even_sum.v1","quantifier_mapping":[["a","integer a"],["b","integer b"]],"schema_version":"1.0.0","status":"researcher_approved","strength_relation":"equivalent"},"source_applicability":[{"bibliographic_status":"confirmed","created_at":"2026-08-19T00:00:00.000000Z","created_by":"actor.manual_researcher","definition_mapping":[["even","same integer definition"]],"evidence_id":"evidence.even_definition_source.v1","hypothesis_compatibility":"compatible","id":"applicability.even_definition.v1","implication_obligation_id":"obligation.even_definition_applicability.v1","implication_verified":true,"imported_hypotheses":["n is an integer"],"imported_statement":"n is even iff n=2k for some integer k","local_claim_id":"claim.even_definition.v1","object_type":"SourceApplicabilityRecord","schema_version":"1.0.0","scope_and_exceptions":["integers only"],"status":"checked"}],"verification_records":[{"claim_id":"claim.even_definition.v1","created_at":"2026-08-19T00:00:00.000000Z","created_by":"actor.manual_researcher","disposition":"accepted","evidence_ids":["evidence.even_definition_source.v1"],"id":"verification.even_definition_applicability.v1","independent_from_proposer":true,"notes":[],"object_type":"VerificationRecord","outcome":"pass","schema_version":"1.0.0","target_statement_hash":"sha256:268451d39d1e967fd2ea231a65a5d86c35e243bd286e8fb87100ddd0718838ea","verifier_kind":"manual_source_applicability_check"},{"claim_id":"claim.integer_algebra_encoding.v1","created_at":"2026-08-19T00:00:00.000000Z","created_by":"actor.manual_researcher","disposition":"accepted","evidence_ids":["evidence.integer_algebra_bridge.v1"],"id":"verification.integer_algebra_bridge.v1","independent_from_proposer":true,"notes":[],"object_type":"VerificationRecord","outcome":"pass","schema_version":"1.0.0","target_statement_hash":"sha256:8ce3d856cc65360e2418a99690acb3ba098d39eba08628030c4dbc59759808e9","verifier_kind":"manual_representation_check"}],"warrants":[{"claim_id":"claim.even_definition.v1","created_at":"2026-08-19T00:00:00.000000Z","created_by":"actor.manual_researcher","evidence_ids":["evidence.even_definition_source.v1"],"id":"warrant.even_definition_source.v1","kind":"source_report","object_type":"EpistemicWarrant","schema_version":"1.0.0","scope":"integer definition only","status":"active","verification_record_ids":["verification.even_definition_applicability.v1"]},{"claim_id":"claim.integer_algebra_encoding.v1","created_at":"2026-08-19T00:00:00.000000Z","created_by":"actor.manual_researcher","evidence_ids":["evidence.integer_algebra_bridge.v1"],"id":"warrant.integer_algebra_bridge.v1","kind":"rigorous_derivation","object_type":"EpistemicWarrant","schema_version":"1.0.0","scope":"integer algebra representation bridge","status":"active","verification_record_ids":["verification.integer_algebra_bridge.v1"]}]}
